batch,index,music,hashtag,author,likes,comments,shares,saves,video_id
1,7,,"@2o9.juniorrr, @just_seann2, viral, fyp, princesos, junje",,396400,731,25400,352,-1
2,0,,"fyp, foryou, mariokart8deluxe, gaming, meme, memecut",,433700,2085,46000,47200,-1
2,12,,"fyp, viral, food, fries, haha, capcut, trend, song, fyp%E3%82%B7, lol",,292600,8776,47600,2193,-1
2,20,,"fyp, foryou, trending, theweeknd, xo, abeltesfaye, xotwod, music",,1700000,6632,161300,14900,-1
2,22,,"@iloverussellwilson, @888tweak, football, nba, kobe, soccer, neymar, fyp, foryou",,806600,2572,79900,1241,-1
2,24,,"@maria.stinkt, howtolacesneakers, shoeslaces, foryoupage%E2%9D%A4%EF%B8%8F%E2%9D%A4%EF%B8%8F, viral, jordan4, from, cocokick",,247400,711,48800,6868,-1
2,25,,"makeup, lipgloss, bigfamily, notenoughnelsons, nenfam, viral, paisleenelson",,219800,2199,15900,649,-1
